<?xml version="1.0"?>
<statusDataType1 xmlns:xsi="http://www.w3.org/2001/XMLSchema-instance"
	xsi:noNamespaceSchemaLocation="statusDataType1Sch.xsd">
	<boatData>
		<ID>1</ID>
		<PositionLat>33</PositionLat>
		<PositionLon>-144</PositionLon>
		<Time>14:02:46</Time>
	</boatData>
	<battData>
		<Battery1>
			<Voltage>12</Voltage>
		</Battery1>
		<Battery2>
			<Voltage>12</Voltage>
		</Battery2>
		<Battery3>
			<Voltage>12</Voltage>
		</Battery3>
		<Battery4>
			<Voltage>12</Voltage>
		</Battery4>
		<Battery5>
			<Voltage>12</Voltage>
		</Battery5>
		<Battery6>
			<Voltage>12</Voltage>
		</Battery6>
		<Battery7>
			<Voltage>12</Voltage>
		</Battery7>
		<Battery8>
			<Voltage>12</Voltage>
		</Battery8>
		<Draw>2.3</Draw>
	</battData>

</statusDataType1>